smartctl 7.3 2022-02-28 r5338 [x86_64-linux-6.1.0-33-amd64] (local build)
Copyright (C) 2002-22, Bruce Allen, Christian Franke, www.smartmontools.org

=== START OF INFORMATION SECTION ===
Model Family:     Apple SD/SM/TS...E/F/G SSDs
Device Model:     APPLE SSD TS0128F
Serial Number:    74RS120ZT8VW
Firmware Version: 109R0219
User Capacity:    121,332,826,112 bytes [121 GB]
Sector Sizes:     512 bytes logical, 4096 bytes physical
Rotation Rate:    Solid State Device
TRIM Command:     Available
Device is:        In smartctl database 7.3/5319
ATA Version is:   ATA8-ACS T13/1699-D revision 6
SATA Version is:  SATA 3.0, 6.0 Gb/s (current: >6.0 Gb/s (4))
Local Time is:    Tue Sep  2 13:44:31 2025 EDT
SMART support is: Available - device has SMART capability.
SMART support is: Enabled
AAM feature is:   Unavailable
APM feature is:   Unavailable
Rd look-ahead is: Enabled
Write cache is:   Enabled
DSN feature is:   Unavailable
ATA Security is:  Unavailable

=== START OF READ SMART DATA SECTION ===
SMART overall-health self-assessment test result: PASSED
See vendor-specific Attribute list for marginal Attributes.

General SMART Values:
Offline data collection status:  (0x00)	Offline data collection activity
					was never started.
					Auto Offline Data Collection: Disabled.
Total time to complete Offline 
data collection: 		(    0) seconds.
Offline data collection
capabilities: 			 (0x00) 	Offline data collection not supported.
SMART capabilities:            (0x0003)	Saves SMART data before entering
					power-saving mode.
					Supports SMART auto save timer.
Error logging capability:        (0x00)	Error logging NOT supported.
					No General Purpose Logging support.

SMART Attributes Data Structure revision number: 40
Vendor Specific SMART Attributes with Thresholds:
ID# ATTRIBUTE_NAME          FLAGS    VALUE WORST THRESH FAIL RAW_VALUE
  1 Raw_Read_Error_Rate     ------   000   100   100    NOW  0
  5 Reallocated_Sector_Ct   ------   000   100   100    NOW  1
  9 Power_On_Hours          ------   000   100   100    NOW  6958
 12 Power_Cycle_Count       ------   000   100   100    NOW  4902
169 Unknown_Apple_Attrib    ---R--   100   100   010    -    971165927680
173 Wear_Leveling_Count     ----C-   166   166   100    -    2014406837057
192 Power-Off_Retract_Count ------   000   100   100    NOW  219
194 Temperature_Celsius     ------   047   100   100    NOW  53 (Min/Max 13/78)
197 Current_Pending_Sector  ------   100   100   100    NOW  0
199 UDMA_CRC_Error_Count    ------   000   100   100    NOW  0
174 Host_Reads_MiB          ------   000   100   100    NOW  46133584
175 Host_Writes_MiB         ------   000   100   100    NOW  20883341
 94 Unknown_Attribute       ---RCK   000   000   ---    -    0
                            ||||||_ K auto-keep
                            |||||__ C event count
                            ||||___ R error rate
                            |||____ S speed/performance
                            ||_____ O updated online
                            |______ P prefailure warning

General Purpose Log Directory not supported

SMART Log Directory Version 1 [multi-sector log support]
Address    Access  R/W   Size  Description
0x00           SL  R/O      1  Log Directory
0xa1           SL  VS       9  Device vendor specific log
0xaa           SL  VS      19  Device vendor specific log
0xab           SL  VS       1  Device vendor specific log

SMART Extended Comprehensive Error Log (GP Log 0x03) not supported

SMART Error Log not supported

SMART Extended Self-test Log (GP Log 0x07) not supported

SMART Self-test Log not supported

Selective Self-tests/Logging not supported

SCT Commands not supported

Device Statistics (GP/SMART Log 0x04) not supported

SATA Phy Event Counters (GP Log 0x11) not supported